Services,Short Description,Details
Electrical Troubleshooting & Repairs,"When electrical problems arise, they can disrupt your entire day. Let our skilled electricians quickly diagnose and repair any electrical issue to keep your home or business running smoothly. Call today for expert troubleshooting and repairs.","When electrical problems arise, they can disrupt your entire day. Let our skilled electricians quickly diagnose and repair any electrical issue to keep your home or business running smoothly. Electrical issues can stem from faulty wiring, overloaded circuits, or outdated systems. Our experts use advanced tools to diagnose and resolve problems efficiently, ensuring your system is safe and reliable. Call today to schedule a service with All Services Electrical."
Surge Protection,"Surge protection isn’t just limited to the power strips you purchase for your appliances and electronics. You can get whole house surge protection to protect your entire electrical system from harmful power surges. To learn more about how you can protect yourself from surges, contact the experts at All Services Electrical.","Surge protection isn’t just limited to power strips. Protect your entire electrical system with whole-house surge protection. Whole-house surge protection shields your electronics from sudden power surges caused by lightning, overloaded circuits, or appliance use. Our experts provide professional installation, giving you peace of mind during storms or electrical spikes. Contact All Services Electrical today to learn more about our surge protection solutions."
"Electrical Panels, Breakers and Fuses",Keep your home safe and efficient with professional electrical panel upgrades and breaker replacements. Outdated panels can pose risks—contact us for an inspection today.,"Keep your home safe and efficient with professional electrical panel upgrades and breaker replacements. Your electrical panel is the core of your home’s power system. If it’s outdated or experiencing issues, it can lead to frequent power outages and potential safety hazards. At All Services Electrical, we provide expert panel upgrades and breaker replacements to meet modern electrical demands and ensure your system operates safely. Contact us for an inspection today."
Wiring & Rewiring,Faulty or outdated wiring is a safety hazard. Upgrade your home or business with professional wiring and rewiring services from All Services Electrical.,"Old, damaged, or outdated wiring can pose serious safety risks, including electrical shocks and fire hazards. If your home or business has aging wiring, it may be time for a professional rewiring service. Our expert electricians specialize in wiring and rewiring to ensure that your electrical system meets modern safety standards and can handle today’s electrical demands. Whether you're upgrading your system for new appliances or ensuring your property is safe, we provide reliable solutions tailored to your needs. Call All Services Electrical today for an electrical inspection or rewiring consultation."
LED Lighting,"Save energy and elevate your space with LED lighting solutions. From installation to retrofitting, we provide expert services to brighten your home or business.","Save energy and elevate your space with LED lighting solutions. LED lighting offers significant energy savings compared to traditional bulbs and provides long-lasting, eco-friendly illumination for your home or business. Whether you need new LED installations or retrofitting for existing fixtures, we offer tailored solutions to suit your style and needs. Our expert electricians ensure proper installation and optimal performance. Contact All Services Electrical today for energy-efficient lighting solutions."
Outdoor Lighting,"Illuminate your outdoor spaces with energy-efficient, weather-resistant lighting solutions. From landscape lighting to security lights, we’ve got you covered.","Illuminate your outdoor spaces with energy-efficient, weather-resistant lighting solutions. From landscape lighting to security lights, outdoor lighting enhances the beauty and security of your property. We specialize in designing and installing custom lighting systems that improve your home’s curb appeal and provide safety features such as motion-activated lights. Let us help you create a well-lit environment for your home or business. Call All Services Electrical today to schedule your outdoor lighting consultation."
Electrical Car Chargers,Charge your electric vehicle at home with ease. We offer expert installation of EV charging stations tailored to your needs. Contact us to get started!,"Charge your electric vehicle (EV) at home with ease. We provide expert installation of EV charging stations to fit your specific needs, whether you require a Level 1, Level 2, or fast-charging station. Having a home charger offers convenience, efficiency, and ensures your EV is always ready to go. Our electricians handle all aspects of the installation process, ensuring compatibility with your electrical system. Contact All Services Electrical today to power up your electric vehicle with reliable charging solutions."
Whole Home Generators,Don’t get left in the dark during a power outage. Protect your home with a reliable whole-home generator. Contact us for installation and maintenance services.,"Don’t get left in the dark during a power outage. Protect your home with a whole-home generator that ensures continuous power during emergencies. Whether it's a storm or a grid failure, a whole-home generator automatically kicks in to keep your essential systems running. We provide expert installation and regular maintenance services, so your generator is always ready when you need it most. Call All Services Electrical today to learn more about whole-home generators and safeguard your home from power interruptions."
Electric Fans,Stay cool and comfortable with professionally installed electric fans. We handle everything from ceiling fans to exhaust fans for your home or business.,"Stay cool and comfortable with professionally installed electric fans. Whether you need ceiling fans for your living room, exhaust fans for your attic, or bathroom fans for ventilation, we offer reliable and energy-efficient fan installations. Electric fans improve air circulation and help lower cooling costs by reducing the need for air conditioning. Our licensed electricians ensure proper wiring and placement for optimal performance. Contact All Services Electrical for expert fan installations today."
Smoke & Carbon Detectors,Protect your family with professionally installed smoke and carbon monoxide detectors. We ensure your devices meet safety standards and are fully operational.,"Protect your family and property with professionally installed smoke and carbon monoxide detectors. These essential safety devices offer early warnings of fire and gas leaks, giving you time to react in case of an emergency. Our expert electricians ensure your detectors are installed in optimal locations and are fully functional, complying with local safety codes. Call All Services Electrical today to install or maintain smoke and carbon monoxide detectors for your home or business."
Appliance Circuits,Ensure your appliances operate safely and efficiently with dedicated circuits installed by licensed electricians. Call us to upgrade your electrical system today!,"Ensure your appliances operate safely and efficiently with dedicated appliance circuits installed by our licensed electricians. High-powered appliances, such as refrigerators, washers, and dryers, require their own dedicated circuits to prevent overloads and electrical issues. We provide expert installation to safeguard your appliances and electrical system, ensuring everything operates smoothly. Call All Services Electrical today for dedicated appliance circuit installations and electrical solutions."
"Doorbells, Intercoms, and Ring Equipment","Upgrade your home with smart doorbells, intercoms, and security systems. From installation to setup, we make it easy to stay connected and secure.","Upgrade your home with smart doorbells, intercoms, and security systems. From video doorbells to complete intercom setups, we offer professional installation and configuration of the latest smart home devices. These systems provide enhanced communication, convenience, and security for your property. Our electricians ensure seamless integration with your existing electrical system for optimal performance. Contact All Services Electrical today to install your smart doorbell, intercom, or Ring system."
Electrical Home Safety,"Prioritize safety with comprehensive electrical inspections, upgrades, and repairs. Protect your family and property with our trusted services.","Prioritize safety with comprehensive electrical inspections, upgrades, and repairs. Electrical systems should always meet the latest safety standards to protect your family and property from potential hazards. We offer services such as circuit inspections, GFCI installation, and grounding improvements to enhance your home’s electrical safety. Our licensed electricians will ensure your system is reliable and secure. Call All Services Electrical today for a safety inspection and peace of mind."
Pool & Spa Electrical,"Keep your pool and spa powered safely with expert electrical installation and repair. We specialize in lighting, pumps, and more.","Keep your pool and spa powered safely with expert electrical installation and repair services. Pools and spas require specialized electrical systems for lights, pumps, heaters, and other equipment. Our team ensures that your pool and spa electrical systems are safely wired, code-compliant, and efficient. Whether you need new installations, upgrades, or repairs, we have the expertise to keep your systems running smoothly. Call All Services Electrical today to schedule your pool and spa electrical services."
